[
  {
    "crosses_component": true,
    "dependency_graph_version": "1.0.0",
    "is_dynamic": false,
    "is_type_only": false,
    "kind": "import",
    "language": "python",
    "resolution": "exact",
    "source_component": "infra:agent-config",
    "source_path": ".agents/skills/auditing-warehouse-source-coverage/scripts/dump_source_inventory.py",
    "specifier": "products.warehouse_sources.backend.temporal.data_imports.sources.common.registry",
    "target_component": "product:warehouse_sources",
    "target_path": "products/warehouse_sources/backend/temporal/data_imports/sources/common/registry.py"
  },
  {
    "crosses_component": false,
    "dependency_graph_version": "1.0.0",
    "is_dynamic": false,
    "is_type_only": false,
    "kind": "import",
    "language": "typescript",
    "resolution": "relative",
    "source_component": "infra:repo-config",
    "source_path": ".github/actions/paths-filter/__tests__/csv-escape.test.ts",
    "specifier": "../src/list-format/csv-escape",
    "target_component": "infra:repo-config",
    "target_path": ".github/actions/paths-filter/src/list-format/csv-escape.ts"
  },
  {
    "crosses_component": false,
    "dependency_graph_version": "1.0.0",
    "is_dynamic": false,
    "is_type_only": false,
    "kind": "import",
    "language": "typescript",
    "resolution": "relative",
    "source_component": "infra:repo-config",
    "source_path": ".github/actions/paths-filter/__tests__/filter.test.ts",
    "specifier": "../src/file",
    "target_component": "infra:repo-config",
    "target_path": ".github/actions/paths-filter/src/file.ts"
  },
  {
    "crosses_component": false,
    "dependency_graph_version": "1.0.0",
    "is_dynamic": false,
    "is_type_only": false,
    "kind": "import",
    "language": "typescript",
    "resolution": "relative",
    "source_component": "infra:repo-config",
    "source_path": ".github/actions/paths-filter/__tests__/filter.test.ts",
    "specifier": "../src/filter",
    "target_component": "infra:repo-config",
    "target_path": ".github/actions/paths-filter/src/filter.ts"
  },
  {
    "crosses_component": false,
    "dependency_graph_version": "1.0.0",
    "is_dynamic": false,
    "is_type_only": false,
    "kind": "import",
    "language": "typescript",
    "resolution": "relative",
    "source_component": "infra:repo-config",
    "source_path": ".github/actions/paths-filter/__tests__/git.test.ts",
    "specifier": "../src/file",
    "target_component": "infra:repo-config",
    "target_path": ".github/actions/paths-filter/src/file.ts"
  },
  {
    "crosses_component": false,
    "dependency_graph_version": "1.0.0",
    "is_dynamic": false,
    "is_type_only": false,
    "kind": "import",
    "language": "typescript",
    "resolution": "relative",
    "source_component": "infra:repo-config",
    "source_path": ".github/actions/paths-filter/__tests__/git.test.ts",
    "specifier": "../src/git",
    "target_component": "infra:repo-config",
    "target_path": ".github/actions/paths-filter/src/git.ts"
  },
  {
    "crosses_component": false,
    "dependency_graph_version": "1.0.0",
    "is_dynamic": false,
    "is_type_only": false,
    "kind": "import",
    "language": "typescript",
    "resolution": "relative",
    "source_component": "infra:repo-config",
    "source_path": ".github/actions/paths-filter/__tests__/shell-escape.test.ts",
    "specifier": "../src/list-format/shell-escape",
    "target_component": "infra:repo-config",
    "target_path": ".github/actions/paths-filter/src/list-format/shell-escape.ts"
  },
  {
    "crosses_component": false,
    "dependency_graph_version": "1.0.0",
    "is_dynamic": false,
    "is_type_only": false,
    "kind": "import",
    "language": "typescript",
    "resolution": "relative",
    "source_component": "infra:repo-config",
    "source_path": ".github/actions/paths-filter/src/filter.ts",
    "specifier": "./file",
    "target_component": "infra:repo-config",
    "target_path": ".github/actions/paths-filter/src/file.ts"
  },
  {
    "crosses_component": false,
    "dependency_graph_version": "1.0.0",
    "is_dynamic": false,
    "is_type_only": false,
    "kind": "import",
    "language": "typescript",
    "resolution": "relative",
    "source_component": "infra:repo-config",
    "source_path": ".github/actions/paths-filter/src/git.ts",
    "specifier": "./file",
    "target_component": "infra:repo-config",
    "target_path": ".github/actions/paths-filter/src/file.ts"
  },
  {
    "crosses_component": false,
    "dependency_graph_version": "1.0.0",
    "is_dynamic": false,
    "is_type_only": false,
    "kind": "import",
    "language": "typescript",
    "resolution": "relative",
    "source_component": "infra:repo-config",
    "source_path": ".github/actions/paths-filter/src/main.ts",
    "specifier": "./file",
    "target_component": "infra:repo-config",
    "target_path": ".github/actions/paths-filter/src/file.ts"
  },
  {
    "crosses_component": false,
    "dependency_graph_version": "1.0.0",
    "is_dynamic": false,
    "is_type_only": false,
    "kind": "import",
    "language": "typescript",
    "resolution": "relative",
    "source_component": "infra:repo-config",
    "source_path": ".github/actions/paths-filter/src/main.ts",
    "specifier": "./filter",
    "target_component": "infra:repo-config",
    "target_path": ".github/actions/paths-filter/src/filter.ts"
  },
  {
    "crosses_component": false,
    "dependency_graph_version": "1.0.0",
    "is_dynamic": false,
    "is_type_only": false,
    "kind": "import",
    "language": "typescript",
    "resolution": "relative",
    "source_component": "infra:repo-config",
    "source_path": ".github/actions/paths-filter/src/main.ts",
    "specifier": "./git",
    "target_component": "infra:repo-config",
    "target_path": ".github/actions/paths-filter/src/git.ts"
  },
  {
    "crosses_component": false,
    "dependency_graph_version": "1.0.0",
    "is_dynamic": false,
    "is_type_only": false,
    "kind": "import",
    "language": "typescript",
    "resolution": "relative",
    "source_component": "infra:repo-config",
    "source_path": ".github/actions/paths-filter/src/main.ts",
    "specifier": "./list-format/csv-escape",
    "target_component": "infra:repo-config",
    "target_path": ".github/actions/paths-filter/src/list-format/csv-escape.ts"
  },
  {
    "crosses_component": false,
    "dependency_graph_version": "1.0.0",
    "is_dynamic": false,
    "is_type_only": false,
    "kind": "import",
    "language": "typescript",
    "resolution": "relative",
    "source_component": "infra:repo-config",
    "source_path": ".github/actions/paths-filter/src/main.ts",
    "specifier": "./list-format/shell-escape",
    "target_component": "infra:repo-config",
    "target_path": ".github/actions/paths-filter/src/list-format/shell-escape.ts"
  },
  {
    "crosses_component": false,
    "dependency_graph_version": "1.0.0",
    "is_dynamic": false,
    "is_type_only": false,
    "kind": "require",
    "language": "javascript",
    "resolution": "relative",
    "source_component": "infra:repo-config",
    "source_path": ".github/scripts/assign-reviewers.js",
    "specifier": "./codeowners",
    "target_component": "infra:repo-config",
    "target_path": ".github/scripts/codeowners.js"
  },
  {
    "crosses_component": false,
    "dependency_graph_version": "1.0.0",
    "is_dynamic": false,
    "is_type_only": false,
    "kind": "require",
    "language": "javascript",
    "resolution": "relative",
    "source_component": "infra:repo-config",
    "source_path": ".github/scripts/assign-reviewers.test.js",
    "specifier": "./assign-reviewers",
    "target_component": "infra:repo-config",
    "target_path": ".github/scripts/assign-reviewers.js"
  },
  {
    "crosses_component": true,
    "dependency_graph_version": "1.0.0",
    "is_dynamic": true,
    "is_type_only": false,
    "kind": "import",
    "language": "python",
    "resolution": "exact",
    "source_component": "infra:repo-config",
    "source_path": ".github/scripts/check-idor-model-coverage.py",
    "specifier": "posthog.models.scoping.manager",
    "target_component": "platform:models",
    "target_path": "posthog/models/scoping/manager.py"
  },
  {
    "crosses_component": false,
    "dependency_graph_version": "1.0.0",
    "is_dynamic": false,
    "is_type_only": false,
    "kind": "require",
    "language": "javascript",
    "resolution": "relative",
    "source_component": "infra:repo-config",
    "source_path": ".github/scripts/ci-alerts-devex.test.js",
    "specifier": "./ci-alerts-devex",
    "target_component": "infra:repo-config",
    "target_path": ".github/scripts/ci-alerts-devex.js"
  },
  {
    "crosses_component": false,
    "dependency_graph_version": "1.0.0",
    "is_dynamic": false,
    "is_type_only": false,
    "kind": "import",
    "language": "javascript",
    "resolution": "relative",
    "source_component": "infra:repo-config",
    "source_path": ".github/scripts/desktop/generate-release-notes.test.mjs",
    "specifier": "./generate-release-notes.mjs",
    "target_component": "infra:repo-config",
    "target_path": ".github/scripts/desktop/generate-release-notes.mjs"
  },
  {
    "crosses_component": false,
    "dependency_graph_version": "1.0.0",
    "is_dynamic": false,
    "is_type_only": false,
    "kind": "require",
    "language": "javascript",
    "resolution": "relative",
    "source_component": "infra:repo-config",
    "source_path": ".github/scripts/label-pr-from-title.test.js",
    "specifier": "./label-pr-from-title",
    "target_component": "infra:repo-config",
    "target_path": ".github/scripts/label-pr-from-title.js"
  },
  {
    "crosses_component": false,
    "dependency_graph_version": "1.0.0",
    "is_dynamic": false,
    "is_type_only": false,
    "kind": "require",
    "language": "javascript",
    "resolution": "relative",
    "source_component": "infra:repo-config",
    "source_path": ".github/scripts/monitor-github-rate-limit.test.js",